listing_key,ticker,exchange,asset_type,name,country,country_code,isin,sector,status,reason,official_reference_name,official_reference_source,covered_by_official_directory,cik,figi,lei
LSE::DIGE,DIGE,LSE,ETF,Amundi MSCI Digital Economy ESG Screened ETF Accumulation,Luxembourg,LU,LU2023678878,Equity,verified,Matched active official exchange directory listing.,MULTI UNITS LUXEMBOURG AMUNDI MSCI DIGITAL ECONOMY UCITS ETF A,lse_price_explorer,True,,BBG00TDHVPN9,
LSE::DMAD,DMAD,LSE,ETF,Global X Disruptive Materials UCITS ETF,Ireland,IE,IE000544AJM3,Equity,verified,Matched active official exchange directory listing.,GLOBAL X ETFS ICAV GLOBAL X DISRUPTIVE MATERIALS UCITS ETF,lse_price_explorer,True,,BBG01B82M809,
LSE::DPYE,DPYE,LSE,ETF,iShares Developed Markets Property Yield UCITS ETF EUR Hedged (Acc),Ireland,IE,IE00BDZVHD04,Real Estate,verified,Matched active official exchange directory listing.,ISHARES II PLC ISH DEV MKTS PPTY YIELD ETF EUR HDG ACC,lse_price_explorer,True,,BBG00K5SL2N5,
LSE::DTLE,DTLE,LSE,ETF,iShares $ Treasury Bond 20+yr UCITS ETF EUR Hedged (Dist),Ireland,IE,IE00BD8PGZ49,Fixed Income,verified,Matched active official exchange directory listing.,ISHARES IV PLC ISH $ TRSRY BOND 20+ YR UCITS  HGD DIST,lse_price_explorer,True,,BBG00HQ02LH6,
LSE::EBIG,EBIG,LSE,ETF,Global X E-commerce UCITS ETF USD Acc GBP,Ireland,IE,IE00BMH5XY61,,verified,Matched active official exchange directory listing.,GLOBAL X ETFS ICAV GLOBAL X E-COMMERCE UCITS ETF,lse_price_explorer,True,,BBG013JYVBK6,
LSE::EDG2,EDG2,LSE,ETF,iShares MSCI EM ESG Enhanced UCITS ETF USD Acc,Ireland,IE,IE00BHZPJ239,Equity,verified,Matched active official exchange directory listing.,ISHARES IV PLC ISH MSCI EM ESG ENH CTB ETF ACC,lse_price_explorer,True,,BBG00QX4KK64,
LSE::EEIA,EEIA,LSE,ETF,WisdomTree Europe Equity Income UCITS ETF Acc,Ireland,IE,IE00BDF16007,Equity,verified,Matched active official exchange directory listing.,WISDOMTREE ISSUER ICAV WT EUROPE EQUITY INCOME UCITS ETF ACC,lse_price_explorer,True,,BBG00F340X01,
LSE::EEXF,EEXF,LSE,ETF,iShares € Corp Bond ex-Financials UCITS ETF EUR (Dist) GBP,Ireland,IE,IE00B4L5ZG21,Fixed Income,verified,Matched active official exchange directory listing.,ISHARES III PLC ISHRS EUR CRP BND EX-FIN ETF EUR (DIST),lse_price_explorer,True,,BBG000CN6KM0,
LSE::EGRG,EGRG,LSE,ETF,WisdomTree Eurozone Quality Dividend Growth UCITS ETF - EUR Acc,Ireland,IE,IE00BZ56TQ67,Equity,verified,Matched active official exchange directory listing.,WISDOMTREE ISSUER ICAV WISDOMTREE EZ QD GROW UCITS ETF-EUR ACC,lse_price_explorer,True,,BBG00D7BC5H6,
LSE::ELLE,ELLE,LSE,ETF,Amundi Global Gender Equality ETF Accumulation,Luxembourg,LU,LU1691909508,Equity,verified,Matched active official exchange directory listing.,MULTI UNITS LUXEMBOURG AMUNDI GLOBAL GENDER EQUALITY ACC,lse_price_explorer,True,,BBG00J4V3DC0,
LSE::EMCV,EMCV,LSE,ETF,Franklin Catholic Principles Emerging Markets Sovereign Debt UCITS ETF USD Acc,Ireland,IE,IE000YZIVX22,Equity,verified,Matched active official exchange directory listing.,FRANKLIN TEMPLETON ICAV FRANKLIN EM SOV DEBT VALUES UCITS ETF,lse_price_explorer,True,,BBG017K707K7,
LSE::EMGB,EMGB,LSE,ETF,Vaneck Vectors UCITS ETFs plc - Vaneck Vectors J.P. Morgan EM Local Currency Bond UCITS ETF,Ireland,IE,IE00BDS67326,Fixed Income,verified,Matched active official exchange directory listing.,VANECK UCITS ETFS PLC VANECK JPM EM LOCAL CURR BOND UCITS ETF,lse_price_explorer,True,,BBG00GX17Q28,
LSE::EMLB,EMLB,LSE,ETF,PIMCO Emerging Markets Advantage Local Bond Source UCITS,Ireland,IE,IE00B4P11460,Fixed Income,verified,Matched active official exchange directory listing.,PIMCO ETFS PUBLIC LIMITED COMPANY PIMCO ADV EM LOCAL BOND UCITS USD AC,lse_price_explorer,True,,BBG0021W6FF7,
LSE::EMSD,EMSD,LSE,ETF,SPDR MSCI Emerging Markets Small Cap UCITS ETF,Ireland,IE,IE00B48X4842,Equity,verified,Matched active official exchange directory listing.,SSGA SPDR ETFS EUROPE I PLC SPDR MSCI EMRG MRKTS SM CAP UCITS ETF $,lse_price_explorer,True,,BBG001Y004B8,
LSE::EMXG,EMXG,LSE,ETF,Amundi MSCI Emerging Ex China ESG Leaders Select UCITS ETF DR USD Acc GBP,Luxembourg,LU,LU2345046655,Equity,verified,Matched active official exchange directory listing.,AMUNDI INDEX SOLUTIONS AMUNDI MSCI EMERGING EX CHINA SELECTION,lse_price_explorer,True,,BBG012X9WV68,
LSE::ENGY,ENGY,LSE,ETF,SPDR® MSCI Europe Energy UCITS ETF,Ireland,IE,IE00BKWQ0F09,Equity,verified,Matched active official exchange directory listing.,SSGA SPDR ETFS EUROPE II PLC SS SPDR MSCI EUR ENE 35/20 CAP UCITS ETF,lse_price_explorer,True,,BBG007PMMZT5,
LSE::EQQJ,EQQJ,LSE,ETF,Invesco NASDAQ Next Generation 100 UCITS ETF Acc,Ireland,IE,IE00BMD8KP97,,verified,Matched active official exchange directory listing.,INVESCO MARKETS II PLC INVESCO NASDQ NEXT GEN 100 UCITS ETF ACC,lse_price_explorer,True,,BBG00ZR7YV47,
LSE::ERNS,ERNS,LSE,ETF,iShares £ Ultrashort Bond UCITS ETF,Ireland,IE,IE00BCRY6441,Fixed Income,verified,Matched active official exchange directory listing.,ISHARES IV PLC ISHS £ ULTRASHORT BD UCITS ETFGBP DIST,lse_price_explorer,True,,BBG005DP5B08,
LSE::ESGJ,ESGJ,LSE,ETF,Invesco Markets II plc - Invesco MSCI Japan ESG Universal Screened UCITS ETF,Ireland,IE,IE00BMDBMV87,Equity,verified,Matched active official exchange directory listing.,INVESCO MARKETS II PLC IVZ MSCI JAPAN UNI SCRN UCITS ETF A,lse_price_explorer,True,,BBG00YMT9XS5,
LSE::ESIH,ESIH,LSE,ETF,iShares MSCI Europe Health Care Sector UCITS ETF,Ireland,IE,IE00BMW42181,Equity,verified,Matched active official exchange directory listing.,ISHARES VI PLC ISH MSCI EPE HCS ACC,lse_price_explorer,True,,BBG00Y6CD347,
LSE::ESRG,ESRG,LSE,ETF,Amundi Index Solutions - Amundi MSCI Europe SRI PAB UCITS ETF DR C GBP,Luxembourg,LU,LU1861137484,Equity,verified,Matched active official exchange directory listing.,AMUNDI INDEX SOLUTIONS AMUNDI MSCI EUROPE SRI CLIMATE PAB C,lse_price_explorer,True,,BBG00Q43ZH69,
LSE::EUCO,EUCO,LSE,ETF,SPDR Barclays Euro Corporate Bond UCITS,Ireland,IE,IE00B3T9LM79,Fixed Income,verified,Matched active official exchange directory listing.,SSGA SPDR ETFS EUROPE I PLC SS SPDR BLOOM EURO CORP BOND UCITS ETF,lse_price_explorer,True,,BBG0024MSQ40,
LSE::EUN,EUN,LSE,ETF,iShares STOXX Europe 50 UCITS,Ireland,IE,IE0008470928,Equity,verified,Matched active official exchange directory listing.,ISHARES II PLC ISHRS STOXX EUROPE 50 UCITS ETF EUR DIST,lse_price_explorer,True,,BBG000C4ZMD6,
LSE::EWQX,EWQX,LSE,ETF,INVESCO MARKETS II PLC IVZ NASDAQ-100 EW UCITS ETF ACC,Ireland,IE,IE000L2SA8K5,Equity,verified,Matched active official exchange directory listing.,INVESCO MARKETS II PLC IVZ NASDAQ-100 EW UCITS ETF ACC,lse_price_explorer,True,,BBG01H6XQPY1,
LSE::FAHY,FAHY,LSE,ETF,Invesco US High Yield Fallen Angels UCITS ETF,Ireland,IE,IE00BD0Q9673,Fixed Income,verified,Matched active official exchange directory listing.,INVESCO MARKETS III PLC INVESCO US HY FALL ANGEL UCITS ETF,lse_price_explorer,True,,BBG00DQ0CGH5,
LSE::FCRU,FCRU,LSE,ETF,WisdomTree WTI Crude Oil Longer Dated,Jersey,JE,JE00B24DLX86,Commodity,verified,Matched active official exchange directory listing.,WISDOMTREE COMMODITY SECURITIES LTD WISDOMTREE WTI CRUDE OIL LONGER DATED,lse_price_explorer,True,,BBG000PTKY38,
LSE::FEIP,FEIP,LSE,ETF,Fidelity Sustainable EUR Corporate Bond Paris Aligned Multifactor UCITS ETF GBP Hedged Acc,Ireland,IE,IE00048UULY2,Fixed Income,verified,Matched active official exchange directory listing.,FIDELITY UCITS II ICAV FIDELITY EUR CORP BOND RE PAB ETF GHA,lse_price_explorer,True,,BBG01J9HSB05,
LSE::FEPG,FEPG,LSE,ETF,HANetf II ICAV - Rex Tech Innovation Premium Income UCITS ETF,Ireland,IE,IE000HF69TA9,Alternative,verified,Matched active official exchange directory listing.,HANETF II ICAV REX TECH INN PREG UCITS ETF DIS ETF GBX,lse_price_explorer,True,,BBG01VPM20Q3,
LSE::FGBL,FGBL,LSE,ETF,First Trust Global Equity Income UCITS ETF Class A USD,Ireland,IE,IE00BYTH6121,Equity,verified,Matched active official exchange directory listing.,FIRST TRUST GLOBAL FUNDS PLC FIRST TRUST GLOBAL EQUITY INC UCITS ETF,lse_price_explorer,True,,BBG009WMP5D3,
LSE::FGOV,FGOV,LSE,ETF,First Trust Low Duration Global Government Bond UCITS ETF Class B GBP Distributing,Ireland,IE,IE00BKS2X200,Fixed Income,verified,Matched active official exchange directory listing.,FIRST TRUST GLOBAL FUNDS PLC FIRST TRUST LOW DUR GLOB GOVT BOND ETF,lse_price_explorer,True,,BBG00XNPZDG2,
LSE::FING,FING,LSE,ETF,Lyxor MSCI World Financials TR UCITS ETF - C-USD,Ireland,IE,IE00BLCHK052,Equity,verified,Matched active official exchange directory listing.,GLOBAL X ETFS ICAV GLOBAL X FINTECH UCITS ETF,lse_price_explorer,True,,BBG013JYW216,
LSE::FLQA,FLQA,LSE,ETF,Franklin FTSE Asia ex China ex Japan UCITS ETF,Ireland,IE,IE00BFWXDV39,Equity,verified,Matched active official exchange directory listing.,FRANKLIN TEMPLETON ICAV FRK ASIA EX CHINA EX JAPAN UCITS ETF,lse_price_explorer,True,,BBG00LWQ7H23,
LSE::FLXU,FLXU,LSE,ETF,Franklin LibertyQ U.S. Equity UCITS ETF,Ireland,IE,IE00BF2B0P08,Equity,verified,Matched active official exchange directory listing.,FRANKLIN TEMPLETON ICAV FRK U.S. EQUITY UCITS ETF,lse_price_explorer,True,,BBG00HMP4J51,
LSE::FRCH,FRCH,LSE,ETF,Franklin FTSE China UCITS ETF GBP,Ireland,IE,IE00BHZRR147,Equity,verified,Matched active official exchange directory listing.,FRANKLIN TEMPLETON ICAV FRK FTSE CHINA UCITS ETF,lse_price_explorer,True,,BBG00P80NMY4,
LSE::FRUC,FRUC,LSE,ETF,Franklin LibertyShares ICAV - Franklin Liberty USD Investment Grade Corporate Bond UCITS ETF,Ireland,IE,IE00BFWXDX52,Fixed Income,verified,Matched active official exchange directory listing.,FRANKLIN TEMPLETON ICAV FRK USD IG CORP BOND UCITS ETF,lse_price_explorer,True,,BBG00L4B0KL6,
LSE::FSKY,FSKY,LSE,ETF,First Trust Cloud Computing UCITS ETF Class A USD Accumulation,Ireland,IE,IE00BFD2H405,Equity,verified,Matched active official exchange directory listing.,FIRST TRUST GLOBAL FUNDS PLC FIRST TRUST CLOUD COMPUTING UCITS ETF,lse_price_explorer,True,,BBG00MV2M2X7,
LSE::FTAL,FTAL,LSE,ETF,SPDR® FTSE UK All Share UCITS ETF Acc,Ireland,IE,IE00B7452L46,Equity,verified,Matched active official exchange directory listing.,SSGA SPDR ETFS EUROPE I PLC SS SPDR FTSE UK ALL-SHARE UCITS ETF,lse_price_explorer,True,,BBG002Q1K485,
LSE::FUSA,FUSA,LSE,ETF,Fidelity US Quality Income ETF Acc,Ireland,IE,IE00BYXVGY31,Equity,verified,Matched active official exchange directory listing.,FIDELITY UCITS ICAV US QUALITY INCOME UCITS ETF USD ACC,lse_price_explorer,True,,BBG00GCM8BF3,
LSE::FWSD,FWSD,LSE,ETF,INVESCO MARKETS II PLC IVZ FTSE WLD UCITS ETF GBP PFHDG DIST,Ireland,IE,IE000UJC4MR1,Equity,verified,Matched active official exchange directory listing.,INVESCO MARKETS II PLC IVZ FTSE WLD UCITS ETF GBP PFHDG DIST,lse_price_explorer,True,,BBG01GWPVJ51,
LSE::GBHG,GBHG,LSE,ETF,Invesco Markets II plc - Invesco Global High Yield Corporate Bond ESG UCITS ETF,Ireland,IE,IE00020C1NS6,Fixed Income,verified,Matched active official exchange directory listing.,INVESCO MARKETS II PLC IVZ GBL HY CORP BD ESG CLIM ETF GB PFH D,lse_price_explorer,True,,BBG018NM6206,
LSE::GBRE,GBRE,LSE,ETF,SPDR® Dow Jones Global Real Estate UCITS ETF,Ireland,IE,IE00B8GF1M35,Equity,verified,Matched active official exchange directory listing.,SSGA SPDR ETFS EUROPE I PLC SS SPDR DOWJONES GLOB REAL EST UCITS ETF,lse_price_explorer,True,,BBG003FWV038,
LSE::GCGB,GCGB,LSE,ETF,UBS AG UBS ETC (CMCI GOLD) GBP,Switzerland,CH,CH0348206308,Commodity,verified,Matched active official exchange directory listing.,UBS AG UBS ETC (CMCI GOLD) GBP,lse_price_explorer,True,,BBG00G4XKHC4,
LSE::GDMS,GDMS,LSE,ETF,Leverage Shares -3x Short Gold Miners ETP Securities,United Kingdom,GB,XS3072228334,Other,verified,Matched active official exchange directory listing.,LEVERAGE SHARES PUBLIC LIMITED CO. LS -3X SHORT GOLD MINERS ETP,lse_price_explorer,True,,BBG013KVC3X5,
LSE::GFGB,GFGB,LSE,ETF,VanEck Global Fallen Angel High Yield Bond UCITS ETF,Ireland,IE,IE00BF540Z61,Fixed Income,verified,Matched active official exchange directory listing.,VANECK UCITS ETFS PLC VANECK GLOBAL FALLEN ANGEL HY BOND ETF,lse_price_explorer,True,,BBG00K9VP1K5,
LSE::GILG,GILG,LSE,ETF,iShares Global Inflation Linked Govt Bond UCITS ETF GBP Hedged (Dist),Ireland,IE,IE00BMDBML89,Fixed Income,verified,Matched active official exchange directory listing.,ISHARES III PLC ISH GLBINFGOV E GBH D,lse_price_explorer,True,,BBG00Y496LG1,
LSE::GLAB,GLAB,LSE,ETF,SPDR® Bloomberg Global Aggregate Bond UCITS ETF GBP Hedged,Ireland,IE,IE00BF1QPJ56,Fixed Income,verified,Matched active official exchange directory listing.,SSGA SPDR ETFS EUROPE I PLC SS SPDR BLOOM GBL AGG £HDG UCITS ETF,lse_price_explorer,True,,BBG00K1JYCH0,
LSE::GLRA,GLRA,LSE,ETF,SPDR Dow Jones Global Real Estate UCITS ETF USD Cap,Ireland,IE,IE00BH4GR342,Real Estate,verified,Matched active official exchange directory listing.,SSGA SPDR ETFS EUROPE I PLC SS SPDR DJ GLOBAL RE UCITS ETF (ACC),lse_price_explorer,True,,BBG00QJ6N3L3,
LSE::GMP,GMP,LSE,ETF,Gabelli Merchant Partners PLC,United Kingdom,GB,GB00BD8P0741,,verified,Matched active official exchange directory listing.,GABELLI MERCHANT PARTNERS PLC ORD USD0.01,lse_instrument_search,True,,BBG00H3T6TT4,
LSE::GOUD,GOUD,LSE,ETF,Lyxor Core Global Government Bond (DR) UCITS ETF GBP,Luxembourg,LU,LU2099288503,Fixed Income,verified,Matched active official exchange directory listing.,MULTI UNITS LUXEMBOURG AMUNDI GLOBAL GOVERNMENT BOND ETF DIST,lse_price_explorer,True,,BBG00VSH0734,
LSE::GS2,GS2,LSE,ETF,Leverage Shares 2x Goldman Sachs ETP Securities A,Ireland,IE,IE00BF03XR19,Other,verified,Matched active official exchange directory listing.,LEVERAGE SHARES PUBLIC LIMITED CO. LEVSHARES 2X GOLDMAN ETP,lse_price_explorer,True,,BBG00J2CHT07,
LSE::H50A,H50A,LSE,ETF,HSBC EURO STOXX 50 UCITS ETF EUR (ACC),Ireland,IE,IE000MWUQBJ0,Equity,verified,Matched active official exchange directory listing.,HSBC ETFS PLC HSBC EURO STOXX 50 UCITS ETF EUR (ACC),lse_price_explorer,True,,BBG018DXKKJ7,
LSE::HCBG,HCBG,LSE,ETF,HSBC Global Funds ICAV - Global Corporate Bond ETF SH GBP,Ireland,IE,IE0005FQHJC4,Fixed Income,verified,Matched active official exchange directory listing.,HSBC GLOBAL FUNDS ICAV HSBC ICAV GLOBAL CORP BOND ETF ETFSHGBP,lse_price_explorer,True,,BBG01HC9MDX9,
LSE::HDLV,HDLV,LSE,ETF,Invesco S&P 500 High Dividend Low Volatility UCITS ETF,Ireland,IE,IE00BWTN6Y99,Equity,verified,Matched active official exchange directory listing.,INVESCO MARKETS III PLC INVESCO S&P 500 HIGH DIV LOW VOL ETF,lse_price_explorer,True,,BBG008KF3H41,
LSE::HEDS,HEDS,LSE,ETF,WisdomTree Europe Equity UCITS ETF - USD Hedged Acc,Ireland,IE,IE00BYQCZP72,Equity,verified,Matched active official exchange directory listing.,WISDOMTREE ISSUER ICAV WT EUROPE EQUITY UCITS ETF USD HED ACC,lse_price_explorer,True,,BBG00F342PF0,
LSE::HEVS,HEVS,LSE,ETF,HSBC MSCI Emerging Markets Value ESG UCITS ETF,Ireland,IE,IE000NVVIF88,,verified,Matched active official exchange directory listing.,HSBC ETFS PLC HSBC MSCI EM VALUE SCR UCITS ETF USD ACC,lse_price_explorer,True,,BBG019WQ1Q52,
LSE::HIEU,HIEU,LSE,ETF,HSBC MSCI Europe Islamic ESG UCITS ETF EUR Acc USD,Ireland,IE,IE000AGFZM58,,verified,Matched active official exchange directory listing.,HSBC ETFS PLC HSBC MSCI EUROPE ISLAMIC SCR ETF EUR ACC,lse_price_explorer,True,,BBG01B9JKPB3,
LSE::HIUS,HIUS,LSE,ETF,HSBC MSCI USA Islamic ESG UCITS ETF,Ireland,IE,IE000I5NV504,,verified,Matched active official exchange directory listing.,HSBC ETFS PLC HSBC MSCI USA ISLAMIC SCR USD ACC,lse_price_explorer,True,,BBG01BC7YR80,
LSE::HMAD,HMAD,LSE,ETF,HSBC ETFs Public Limited Company - HSBC MSCI AC Far East ex Japan UCITS ETF,Ireland,IE,IE00BBQ2W338,Equity,verified,Matched active official exchange directory listing.,HSBC ETFS PLC HSBC MSCI AC FAR EAST EXJAPAN UCITSETF $,lse_price_explorer,True,,BBG0057ZX6H5,
LSE::HMEM,HMEM,LSE,ETF,HSBC MSCI Emerging Markets UCITS ETF,Ireland,IE,IE00B5SSQT16,Equity,verified,Matched active official exchange directory listing.,HSBC ETFS PLC HSBC MSCI EMERGING MARKETS UCITS ETF $,lse_price_explorer,True,,BBG0021VPNC4,
LSE::HMWA,HMWA,LSE,ETF,HSBC MSCI World UCITS ETF USD (Acc),Ireland,IE,IE000UQND7H4,Equity,verified,Matched active official exchange directory listing.,HSBC ETFS PLC HSBC MSCI WORLD UCITS ETF USD (ACC),lse_price_explorer,True,,BBG018DXGWL3,
LSE::HNCS,HNCS,LSE,ETF,HSBC NASDAQ Global Climate Tech UCITS ETF USD Acc GBP,Ireland,IE,IE000XC6EVL9,Equity,verified,Matched active official exchange directory listing.,HSBC ETFS PLC HSBC NASDAQ GLOBAL CLIM TECH ETF USD ACC,lse_price_explorer,True,,BBG01JJ3T749,
LSE::HPAU,HPAU,LSE,ETF,HSBC MSCI USA Climate Paris Aligned UCITS ETF USD Acc,Ireland,IE,IE00BP2C1S34,,verified,Matched active official exchange directory listing.,HSBC ETFS PLC HSBC MSCI USA CLIMATE PARIS UCITS ETF,lse_price_explorer,True,,BBG0120C1XF7,
LSE::HPNS,HPNS,LSE,ETF,HSBC FTSE EPRA NAREIT Developed Paris Aligned UCITS ETF USD (Acc) GBP,Ireland,IE,IE00096S6AV7,Equity,verified,Matched active official exchange directory listing.,HSBC ETFS PLC HSBC FTSE EPRA NAR DEV CPA ETF USD (ACC),lse_price_explorer,True,,BBG01LM07Y05,
LSE::HSDS,HSDS,LSE,ETF,HSBC Developed World Sustainable Equity UCITS ETF,Ireland,IE,IE000ZGT8JM8,Equity,verified,Matched active official exchange directory listing.,HSBC ETFS PLC HSBC DEV WLD SCREENED EQ ETF USD DIST,lse_price_explorer,True,,BBG018V5YMX3,
LSE::HSGG,HSGG,LSE,ETF,HSBC GLOBAL FUNDS ICAV HSBC ICA,Ireland,IE,IE000VYC5HU2,,verified,Matched active official exchange directory listing.,HSBC GLOBAL FUNDS ICAV HSBC ICAV GL ESG GOV BOND ETF ETFSHGBP,lse_price_explorer,True,,BBG01GY5JS84,
LSE::HSPS,HSPS,LSE,ETF,HSBC S&P 500 UCITS ETF USD (Acc) GBP,Ireland,IE,IE000JZ473P7,,verified,Matched active official exchange directory listing.,HSBC ETFS PLC HSBC S&P 500 UCITS ETF USD (ACC),lse_price_explorer,True,,BBG0184CVQ71,
LSE::HSWO,HSWO,LSE,ETF,HSBC Developed World Sustainable Equity UCITS ETF GBP,Ireland,IE,IE00BKY59K37,Equity,verified,Matched active official exchange directory listing.,HSBC ETFS PLC HSBC DEV WORLD SCREENED EQUITY ETF,lse_price_explorer,True,,BBG00VXCSRL5,
LSE::HTWO,HTWO,LSE,ETF,L&G Hydrogen Economy UCITS ETF-USD Acc,Ireland,IE,IE00BMYDM794,,verified,Matched active official exchange directory listing.,LEGAL & GENERAL UCITS ETF PLC L&G HYDROGEN ECONOMY ETF,lse_price_explorer,True,,BBG00Z1WKMF3,
LSE::HWVS,HWVS,LSE,ETF,HSBC MSCI World Value ESG UCITS ETF USD (Acc) GBP,Ireland,IE,IE000LYBU7X5,Equity,verified,Matched active official exchange directory listing.,HSBC ETFS PLC HSBC MSCI WORLD VALUE SCR ETF USD ACC,lse_price_explorer,True,,BBG019WQ1BP3,
LSE::HYGB,HYGB,LSE,ETF,VanEck Emerging Markets High Yield Bond UCITS ETF USD,Ireland,IE,IE00BF541080,Fixed Income,verified,Matched active official exchange directory listing.,VANECK UCITS ETFS PLC VANECK EMERGING MARKET HY BOND UCITS ETF,lse_price_explorer,True,,BBG00K9V7ZN7,
LSE::IAAA,IAAA,LSE,ETF,iShares Global AAA-AA Government Bond UCITS,Ireland,IE,IE00B87G8S03,Fixed Income,verified,Matched active official exchange directory listing.,ISHARES VI PLC ISHRS GLOBAL AAA-AA GVT BND ETF USD DIST,lse_price_explorer,True,,BBG003G0S585,
LSE::IB01,IB01,LSE,ETF,iShares $ Treasury Bond 0-1yr UCITS ETF USD (Acc),Ireland,IE,IE00BGSF1X88,Fixed Income,verified,Matched active official exchange directory listing.,ISHARES PLC ISH $ TR BND 0-1YR U-A,lse_price_explorer,True,,BBG00NBPHQ05,
LSE::IBTS,IBTS,LSE,ETF,iShares $ Treasury Bond 1-3yr UCITS ETF USD (Dist),Ireland,IE,IE00B14X4S71,Fixed Income,verified,Matched active official exchange directory listing.,ISHARES PLC ISHARES $TRES.BD1-3YR UCITS ETF USD DIST,lse_price_explorer,True,,BBG000J13Q69,
LSE::ICOM,ICOM,LSE,ETF,iShares Diversified Commodity Swap UCITS ETF,Ireland,IE,IE00BDFL4P12,,verified,Matched active official exchange directory listing.,ISHARES VI PLC ISHARES DIVERSIFIED COMM SWP UCITS ETF,lse_price_explorer,True,,BBG00H1LS1Z3,
LSE::ID33,ID33,LSE,ETF,iShares iBonds Dec 2033 Term $ Corp UCITS ETF USD (Acc),Ireland,IE,IE000K44CW70,Fixed Income,verified,Matched active official exchange directory listing.,ISHARES V PLC ISHRS IBNDS DC 2033 TRM $ CRP UCITS ETF,lse_price_explorer,True,,BBG01QJ6NF35,
LSE::IDFN,IDFN,LSE,ETF,Invesco Markets II plc - Invesco Defence Innovation UCITS ETF,Ireland,IE,IE000BRM9046,,verified,Matched active official exchange directory listing.,INVESCO MARKETS II PLC INVESCO DEFENCE INNOVATION UCITS ETF ACC,lse_price_explorer,True,,BBG01Q1VQ2G1,
LSE::IDTG,IDTG,LSE,ETF,iShares IV Public Limited Company - iShares $ Treasury Bond 20+yr UCITS ETF,Ireland,IE,IE00BK5MT033,Fixed Income,verified,Matched active official exchange directory listing.,ISHARES IV PLC ISH $TSY 20+ GBP HG DIST,lse_price_explorer,True,,BBG00QXQCH43,
LSE::IDWP,IDWP,LSE,ETF,iShares Developed Markets Property Yield UCITS,Ireland,IE,IE00B1FZS350,Real Estate,verified,Matched active official exchange directory listing.,ISHARES II PLC ISHRS DEV MRKTS PROP YIELD ETF USD DIST,lse_price_explorer,True,,BBG000D526Y0,
LSE::IEDL,IEDL,LSE,ETF,iShares Edge MSCI Europe Value Factor UCITS ETF EUR (Dist),Ireland,IE,IE00BG13YH41,Equity,verified,Matched active official exchange directory listing.,ISHARES IV PLC ISH EUROPE VALUE ETF EUR DIST,lse_price_explorer,True,,BBG00JZ9X4R6,
LSE::IEFV,IEFV,LSE,ETF,iShares MSCI Europe Value Factor UCITS,Ireland,IE,IE00BQN1K901,Equity,verified,Matched active official exchange directory listing.,ISHARES IV PLC ISHS EDGE MSCI EUR VAL FAC UCITS ETF ACC,lse_price_explorer,True,,BBG007X18934,
LSE::IESG,IESG,LSE,ETF,iShares MSCI Europe SRI UCITS ETF EUR (Acc),Ireland,IE,IE00B52VJ196,Equity,verified,Matched active official exchange directory listing.,ISHARES II PLC ISHR DW JNES EUR SUST SCRNED ETF EUR ACC,lse_price_explorer,True,,BBG001K5X1K2,
LSE::IGAA,IGAA,LSE,ETF,iShares Emerging Asia Local Govt Bond UCITS ETF USD (Acc),Ireland,IE,IE00BFM6T814,Fixed Income,verified,Matched active official exchange directory listing.,ISHARES III PLC ISH E ASIA LOCAL GOVT BND ETF USD ACC,lse_price_explorer,True,,BBG00KSMRVR9,
LSE::IGLG,IGLG,LSE,ETF,iShares Physical Gold GBP Hedged ETC,Ireland,IE,IE000Q2P3ZQ3,Commodity,verified,Matched active official exchange directory listing.,ISHARES PHYSICAL METALS PLC ISHARES PHYSICAL GOLD GBP HEDGED ETC,lse_price_explorer,True,,BBG018MT7309,
LSE::IGSU,IGSU,LSE,ETF,iShares Dow Jones Global Sustainability Screened UCITS ETF USD (Acc),Ireland,IE,IE00B57X3V84,,verified,Matched active official exchange directory listing.,ISHARES II PLC ISHRS DW JNES GLB SCREENED ETF USD ACC,lse_price_explorer,True,,BBG001K3V4R6,
LSE::IHYE,IHYE,LSE,ETF,iShares $ High Yield Corp Bond UCITS ETF EUR Hedged (Dist),Ireland,IE,IE00BF3N7102,Fixed Income,verified,Matched active official exchange directory listing.,ISHARES II PLC ISH $ HY CORP BOND UCITS ETF EUR HDG D,lse_price_explorer,True,,BBG00J5H9KM7,
LSE::IJPD,IJPD,LSE,ETF,iShares Public Limited Company - iShares MSCI Japan USD Hedged UCITS ETF (Acc),Ireland,IE,IE00BCLWRG39,Equity,verified,Matched active official exchange directory listing.,ISHARES PLC ISHARES MSCI JAPAN $ HDG UCITS ETF (ACC),lse_price_explorer,True,,BBG005CHF0Y3,
LSE::IMBA,IMBA,LSE,ETF,iShares US Mortgage Backed Securities UCITS Acc,Ireland,IE,IE00BYXYYN70,Fixed Income,verified,Matched active official exchange directory listing.,ISHARES IV PLC IS US MORT BACK SEC UCITS ETF USD ACC,lse_price_explorer,True,,BBG00GF9PKV2,
LSE::IMVU,IMVU,LSE,ETF,iShares Edge MSCI Europe Minimum Volatility UCITS ETF EUR (Acc) USD,Ireland,IE,IE00B86MWN23,Equity,verified,Matched active official exchange directory listing.,ISHARES VI PLC IS EDGE MSCI EUR MIN VOL,lse_price_explorer,True,,BBG0087F52L8,
LSE::INMG,INMG,LSE,ETF,UBS CMCI Industrial Metals GBP ETC,Switzerland,CH,CH0348206241,Equity,verified,Matched active official exchange directory listing.,UBS AG UBS ETC (CMCI INDUSTRIAL MTLS) GBP,lse_price_explorer,True,,BBG00G4XJM80,
LSE::IOGP,IOGP,LSE,ETF,iShares Oil & Gas Exploration & Production UCITS ETF USD (Acc),Ireland,IE,IE00B6R51Z18,Equity,verified,Matched active official exchange directory listing.,ISHARES V PLC ISHRS OIL & GAS EXPL & PROD ETF USD ACC,lse_price_explorer,True,,BBG0022QX3C9,
LSE::IQCY,IQCY,LSE,ETF,Amundi Index Solutions - Amundi MSCI Smart Cities ESG Screened UCITS ETF – Acc GBP,Luxembourg,LU,LU2037748345,Equity,verified,Matched active official exchange directory listing.,AMUNDI INDEX SOLUTIONS AMUNDI MSCI SMART CITIES UCITS ETF ACC,lse_price_explorer,True,,BBG01MLXYYN7,
LSE::IS15,IS15,LSE,ETF,iShares £ Corp Bond 0-5yr UCITS ETF,Ireland,IE,IE00B5L65R35,Fixed Income,verified,Matched active official exchange directory listing.,ISHARES PLC ISHARES £ CORP BD 0-5 UCITS ETF GBP DIST,lse_price_explorer,True,,BBG0015QT3Y9,
LSE::ISFD,ISFD,LSE,ETF,iShares Core FTSE 100 UCITS USD Hedged Acc,Ireland,IE,IE00BYZ28W67,Equity,verified,Matched active official exchange directory listing.,ISHARES PLC ISHARES COR FTSE 100 UCITS USD HDG (ACC),lse_price_explorer,True,,BBG00HZG5Q96,
LSE::ISUS,ISUS,LSE,ETF,iShares MSCI USA Islamic UCITS,Ireland,IE,IE00B296QM64,Equity,verified,Matched active official exchange directory listing.,ISHARES II PLC ISHRS MSCI USA ISLMIC UCITS ETF USD DIST,lse_price_explorer,True,,BBG000C1WJD2,
LSE::ITEH,ITEH,LSE,ETF,iShares Italy Govt Bond UCITS ETF USD Hedged (Acc),Ireland,IE,IE00BFMM9235,Fixed Income,verified,Matched active official exchange directory listing.,ISHARES V PLC ISH ITALY GVT BOND UCITS ETF USD HG ACC,lse_price_explorer,True,,BBG00KG9GJD5,
LSE::IUAA,IUAA,LSE,ETF,iShares US Aggregate Bond UCITS Acc,Ireland,IE,IE00BYXYYM63,Fixed Income,verified,Matched active official exchange directory listing.,ISHARES II PLC ISHARES US AGG BOND UCITS ETF USD (ACC),lse_price_explorer,True,,BBG00GF9PY51,
LSE::IUFS,IUFS,LSE,ETF,iShares S&P 500 Financials Sector UCITS ETF USD (Acc),Ireland,IE,IE00B4JNQZ49,Equity,verified,Matched active official exchange directory listing.,ISHARES V PLC ISHRS S&P 500 FIN SECT ETF USD (ACC),lse_price_explorer,True,,BBG00BDQVDQ2,
