ticker,exchange,asset_type,name,cotahist_ticker,cotahist_name,cotahist_bdi_code,cotahist_market_type,cotahist_date,cotahist_isin,decision
2WAV3,B3,Stock,2W ECOBANK S.A.,,,,,,,no_cotahist_match
A6OP3,B3,Stock,ACESSOPAR INVESTIMENTOS E PARTICIPAÇÕES S.A.,,,,,,,no_cotahist_match
AFOF11,B3,ETF,Alianza Fofii Fundo De Investimento Imobiliario,,,,,,,no_cotahist_match
AGBK4,B3,Stock,BANCO AGIBANK S.A.,,,,,,,no_cotahist_match
AGCX11,B3,ETF,FDO INV IMOB RIO BRAVO RENDA VAREJO - FII,,,,,,,no_cotahist_match
AGPL11,B3,ETF,MAGNETIS TEVA AÇÕES AGRONEGOCIO ETF FDO IND,,,,,,,no_cotahist_match
AGRA4,B3,Stock,AGRALE S/A,,,,,,,no_cotahist_match
AMZG3,B3,Stock,AMAZONAS DISTRIBUIDORA DE ENERGIA S.A.,,,,,,,no_cotahist_match
AQLL11,B3,ETF,ÁQUILLA FDO INV IMOB - FII,,,,,,,no_cotahist_match
ATEA3,B3,Stock,ATHENA SAUDE BRASIL S.A.,,,,,,,no_cotahist_match
BCEE3,B3,Stock,BANCO BESA S/A,,,,,,,no_cotahist_match
BCEE5,B3,Stock,BANCO BESA S/A,,,,,,,no_cotahist_match
BCPS3,B3,Stock,CLARO S.A.,,,,,,,no_cotahist_match
BCPS4,B3,Stock,CLARO S.A.,,,,,,,no_cotahist_match
BEGB4,B3,Stock,BANCO BERJ S.A.,,,,,,,no_cotahist_match
BFFT3,B3,Stock,Bluefit Academias de Ginástica e Participações S.A,,,,,,,no_cotahist_match
BNAC3,B3,Stock,BANCO NACIONAL S/A,,,,,,,no_cotahist_match
BNAC4,B3,Stock,BANCO NACIONAL S/A,,,,,,,no_cotahist_match
BNRG3,B3,Stock,BRAZIL ENERGY S.A.,,,,,,,no_cotahist_match
BRBI3,B3,Stock,BRBI BR PARTNERS S.A.,,,,,,,no_cotahist_match
BRBI4,B3,Stock,BRBI BR PARTNERS S.A.,,,,,,,no_cotahist_match
BTCE11,B3,ETF,BITCOIN ETC KARDINAL FUNDO DE ÍNDICE – IE,,,,,,,no_cotahist_match
BVEN3,B3,Stock,BOA VISTA ENERGIA S.A.,,,,,,,no_cotahist_match
C1GT3,B3,Stock,CELG TRANSMISSÃO S.A. - CELG T,,,,,,,no_cotahist_match
C3RP3,B3,Stock,COTRASA PARTICIPACOES S.A.,,,,,,,no_cotahist_match
CATA3,B3,Stock,CIA INDUSTRIAL CATAGUASES,,,,,,,no_cotahist_match
CATA4,B3,Stock,CIA INDUSTRIAL CATAGUASES,,,,,,,no_cotahist_match
CBOH3,B3,Stock,CBO HOLDING S.A.,,,,,,,no_cotahist_match
CCAT3,B3,Stock,COMFIO COMPANHIA CATARINENSE DE FIACAO,,,,,,,no_cotahist_match
CCAT4,B3,Stock,COMFIO COMPANHIA CATARINENSE DE FIACAO,,,,,,,no_cotahist_match
CEAC3,B3,Stock,ENERGISA ACRE - DISTRIBUIDORA DE ENERGIA S.A,,,,,,,no_cotahist_match
CEAC4,B3,Stock,ENERGISA ACRE - DISTRIBUIDORA DE ENERGIA S.A,,,,,,,no_cotahist_match
CEAG3,B3,Stock,CIA DE ENTREPOSTOS E ARMAZENS GERAIS SP,,,,,,,no_cotahist_match
CEAL3,B3,Stock,EQUATORIAL ALAGOAS - DISTRIBUIDORA DE ENERGIA S.A.,,,,,,,no_cotahist_match
CEAL4,B3,Stock,EQUATORIAL ALAGOAS - DISTRIBUIDORA DE ENERGIA S.A.,,,,,,,no_cotahist_match
CEAP3,B3,Stock,COMPANHIA DE ELETRICIDADE DO AMAPÁ - CEA,,,,,,,no_cotahist_match
CEBD3,B3,Stock,Neoenergia Distribuicao Brasilia S.A,,,,,,,no_cotahist_match
CEEP3,B3,Stock,CIA EST. DE ENERG. ELETRICA PARTICIPAÇÕES CEEE-PAR,,,,,,,no_cotahist_match
CERO3,B3,Stock,ENERGISA RONDONIA - DISTRIBUIDORA DE ENERGIA S/A,,,,,,,no_cotahist_match
CESA3,B3,Stock,CIA ESTADUAL DE SILOS E ARMAZENS,,,,,,,no_cotahist_match
CFHO3,B3,Stock,CARVALHO HOLDINGS SA,,,,,,,no_cotahist_match
CFHO4,B3,Stock,CARVALHO HOLDINGS SA,,,,,,,no_cotahist_match
CGOS3,B3,Stock,EQUATORIAL GOIAS DISTRIBUIDORA DE ENERGIA S/A,,,,,,,no_cotahist_match
CLNT3,B3,Stock,CLARANET TECHNOLOGY S.A.,,,,,,,no_cotahist_match
CMNS3,B3,Stock,CMN SOLUTIONS AO18 PARTICIPACOES S.A.,,,,,,,no_cotahist_match
CNRT5,B3,Stock,CICANORTE IND CONSERVAS ALIMENTICIAS S.A,,,,,,,no_cotahist_match
COCN5,B3,Stock,CIA DE COCOS DO NORDESTE,,,,,,,no_cotahist_match
CONX3,B3,Stock,TRIPLE PLAY BRASIL PARTICIPAÇÕES S.A.,,,,,,,no_cotahist_match
CPCH3,B3,Stock,CAPITAL CENTER HOTEIS S.A.,,,,,,,no_cotahist_match
CPCH7,B3,Stock,CAPITAL CENTER HOTEIS S.A.,,,,,,,no_cotahist_match
CPIS12,B3,Stock,EQUATORIAL PIAUI DISTRIBUIDORA DE ENERGIA S.A,,,,,,,no_cotahist_match
CPIS3,B3,Stock,EQUATORIAL PIAUI DISTRIBUIDORA DE ENERGIA S.A,,,,,,,no_cotahist_match
CPIS4,B3,Stock,EQUATORIAL PIAUI DISTRIBUIDORA DE ENERGIA S.A,,,,,,,no_cotahist_match
CPNO7,B3,Stock,COPENOR - CIA PETROQUIMICA DO NORDESTE,,,,,,,no_cotahist_match
CPTS11B,B3,ETF,Capitania Securities II Fundo Investimento Imobiliario FII,,,,,,,no_cotahist_match
CRML4,B3,Stock,CARBOMIL S.A.,,,,,,,no_cotahist_match
CRPC4,B3,Stock,CRP CADERI CAPITAL DE RISCO S/A,,,,,,,no_cotahist_match
CRTE3,B3,Stock,CONC RIO-TERESOPOLIS S.A.,,,,,,,no_cotahist_match
CRTE5,B3,Stock,CONC RIO-TERESOPOLIS S.A.,,,,,,,no_cotahist_match
CSAL4,B3,Stock,CIA ABASTEC. D'AGUA E SAN. EST. ALAGOAS,,,,,,,no_cotahist_match
CSAM3,B3,Stock,COSAMA - CIA DE SANEAMENTO DA AMAZONIA,,,,,,,no_cotahist_match
CSAM4,B3,Stock,COSAMA - CIA DE SANEAMENTO DA AMAZONIA,,,,,,,no_cotahist_match
DASS3,B3,Stock,DASS NORDESTE CALÇADOS E ARTIGOS ESPORTIVOS SA,,,,,,,no_cotahist_match
DNEN3B,B3,Stock,DINAMICA ENERGIA S.A.,,,,,,,no_cotahist_match
DTEN3,B3,Stock,DETEN QUIMICA S.A.,,,,,,,no_cotahist_match
DTEN6,B3,Stock,DETEN QUIMICA S.A.,,,,,,,no_cotahist_match
DXXI3,B3,Stock,DUXXI IMOBILIÁRIA S.A.,,,,,,,no_cotahist_match
E3XT3,B3,Stock,IMIFARMA PRODUTOS FARMACEUTICOS E COSMETICOS SA,,,,,,,no_cotahist_match
EBRK11,B3,ETF,INVESTO BLUESTAR US LISTED E-BROKERS ETF FDO INV,,,,,,,no_cotahist_match
EBTL3,B3,Stock,EMBRATEL - EMPR.BRASILEIRA DE TELEC S.A.,,,,,,,no_cotahist_match
EC3S3,B3,Stock,ENERGETICA CORUMBA III S.A.,,,,,,,no_cotahist_match
EC3S4,B3,Stock,ENERGETICA CORUMBA III S.A.,,,,,,,no_cotahist_match
EESG3,B3,Stock,ENVIRONMENTAL ESG PARTICIPAÇÕES S.A.,,,,,,,no_cotahist_match
EGCE3,B3,Stock,ENERGISA GERACAO CENTRAIS EOLICAS RN S.A.,,,,,,,no_cotahist_match
ELBR4,B3,Stock,ELEBRA S/A ELETRONICA BRASILEIRA,,,,,,,no_cotahist_match
EMBP3,B3,Stock,EMBRAPAR PARTICIPACOES S.A.,,,,,,,no_cotahist_match
EMBP4,B3,Stock,EMBRAPAR PARTICIPACOES S.A.,,,,,,,no_cotahist_match
ENAC3,B3,Stock,CIA ARMAZENS GERAIS ENTREPOSTOS DO ACRE,,,,,,,no_cotahist_match
EPTR4,B3,Stock,EMPR TURISMO DE PERNAMBUCO S.A. -EMPETUR,,,,,,,no_cotahist_match
ESGG11,B3,ETF,INVESTO FTSE US ALL CAP CHOICE ETF FDO INV IND IE,,,,,,,no_cotahist_match
ESGS3,B3,Stock,COMPANHIA DE GAS DO ESPIRITO SANTO - ES GAS,,,,,,,no_cotahist_match
ESGS4,B3,Stock,COMPANHIA DE GAS DO ESPIRITO SANTO - ES GAS,,,,,,,no_cotahist_match
ESSD3,B3,Stock,ENERGISA SUL-SUDESTE DISTRIBUIDORA DE ENERGIA S.A.,,,,,,,no_cotahist_match
ESSE5,B3,Stock,ESSENCIA AGROPECUARIA S.A.,,,,,,,no_cotahist_match
ETGO3,B3,Stock,EMPR DE TRANSP URBANO DO EST GOIAS S.A.,,,,,,,no_cotahist_match
ETGO4,B3,Stock,EMPR DE TRANSP URBANO DO EST GOIAS S.A.,,,,,,,no_cotahist_match
ETHI11,B3,ETF,IT NOW BLOOMBERG GALAXY ETHEREUM FUNDO DE ÍNDICE,,,,,,,no_cotahist_match
F8DF5,B3,Stock,FRIGORIFICO DIAS S/A - FRIGODIAS,,,,,,,no_cotahist_match
FAEL6,B3,Stock,FAE -FERRAGENS E APARELHOS ELETRICOS S.A,,,,,,,no_cotahist_match
FAEL7,B3,Stock,FAE -FERRAGENS E APARELHOS ELETRICOS S.A,,,,,,,no_cotahist_match
FGRT5,B3,Stock,FRIGORIFICO REDENTOR S.A.,,,,,,,no_cotahist_match
FMNP3,B3,Stock,FIRMINOPOLIS TRANSMISSAO S.A.,,,,,,,no_cotahist_match
FNUV3,B3,Stock,FENAUVA-FEIRA NAC DA UVA TUR E EMPR S.A.,,,,,,,no_cotahist_match
FRNV3,B3,Stock,CIA DE NAVEG DO SAO FRANCISCO - FRANAVE,,,,,,,no_cotahist_match
FTRO3,B3,Stock,FRUTOS TROPICAIS S/A,,,,,,,no_cotahist_match
GENT3,B3,Stock,LG INFORMÁTICA S.A.,,,,,,,no_cotahist_match
GPLA5,B3,Stock,GEPLAN HOTEIS S.A.,,,,,,,no_cotahist_match
GUNI3,B3,Stock,GRUPO UNI.CO S.A.,,,,,,,no_cotahist_match
H2OO11,B3,ETF,TREND ETF NASDAQ WATER RESOURCE FDO INV DE ÍNDICE,,,,,,,no_cotahist_match
HCAR3,B3,Stock,HOSPITAL CARE CALEDONIA S.A.,,,,,,,no_cotahist_match
HEDA3,B3,Stock,HEDERA INVESTIMENTOS E PARTICIPAÇÕES S.A,,,,,,,no_cotahist_match
HLJP3,B3,Stock,HOTEL LAJE DE PEDRA S.A.,,,,,,,no_cotahist_match
HOAM5,B3,Stock,CIA TROPICAL DE HOTEIS DA AMAZONIA,,,,,,,no_cotahist_match
HOAM6,B3,Stock,CIA TROPICAL DE HOTEIS DA AMAZONIA,,,,,,,no_cotahist_match
ICBR3,B3,Stock,INTERCEMENT BRASIL S.A.,,,,,,,no_cotahist_match
IMBB11,B3,ETF,Etf Bradesco Ima-B Fundo De Indice,,,,,,,no_cotahist_match
INDA11,B3,ETF,TREND ETF MSCI INDIA FDO DE INV DE ÍNDICE,,,,,,,no_cotahist_match
IPNN3,B3,Stock,TESTE IPN VS SA,,,,,,,no_cotahist_match
IVLG3B,B3,Stock,INVITEL LEGACY S.A.,,,,,,,no_cotahist_match
IVPR3B,B3,Stock,INVESTIMENTOS E PARTICIP. EM INFRA S.A. - INVEPAR,,,,,,,no_cotahist_match
IVPR4B,B3,Stock,INVESTIMENTOS E PARTICIP. EM INFRA S.A. - INVEPAR,,,,,,,no_cotahist_match
JCBA6,B3,Stock,J C BARRETTO FERTILIZANTES S.A.,,,,,,,no_cotahist_match
KALS5,B3,Stock,KA 2 LAUNDRY SERVICES S.A.,,,,,,,no_cotahist_match
KALU3,B3,Stock,KALUNGA S.A,,,,,,,no_cotahist_match
LAZT3,B3,Stock,LAGO AZUL TRANSMISSO S.A.,,,,,,,no_cotahist_match
LMED3,B3,Stock,LIFEMED INDUSTRIAL EQUIP. DE ART. MÉD. HOSP. S.A.,,,,,,,no_cotahist_match
LOGS3,B3,Stock,LOGASA INDUSTRIA E COMERCIO S.A.,,,,,,,no_cotahist_match
LOGS4,B3,Stock,LOGASA INDUSTRIA E COMERCIO S.A.,,,,,,,no_cotahist_match
LTEL3B,B3,Stock,LITEL PARTICIPACOES S.A.,,,,,,,no_cotahist_match
LTLA3B,B3,Stock,LITELA PARTICIPAÇÕES S.A.,,,,,,,no_cotahist_match
MAQN3,B3,Stock,MAQUINA DE VENDAS BRASIL PARTICIPAÇÕES S.A.,,,,,,,no_cotahist_match
MAQN4,B3,Stock,MAQUINA DE VENDAS BRASIL PARTICIPAÇÕES S.A.,,,,,,,no_cotahist_match
MBRF11,B3,ETF,Fundo De Investimento Imobiliário Mercantil Do Brasil-fii -Inicio,,,,,,,no_cotahist_match
MDIN3,B3,Stock,MUNDIAL INC,,,,,,,no_cotahist_match
MDSI3,B3,Stock,MUNDIAL ASIA HONG KONG,,,,,,,no_cotahist_match
MGFB3,B3,Stock,M&G FIBRAS HOLDING S.A.,,,,,,,no_cotahist_match
MKSS3,B3,Stock,MKS SOLUÇÕES INTEGRADAS S.A.,,,,,,,no_cotahist_match
MMBR3,B3,Stock,MAGNETI MARELLI DO BRASIL IND.COM S.A.,,,,,,,no_cotahist_match
MMBR4,B3,Stock,MAGNETI MARELLI DO BRASIL IND.COM S.A.,,,,,,,no_cotahist_match
MMCA3,B3,Stock,MAGNETI MARELLI COFAP AUTOPECAS S.A.,,,,,,,no_cotahist_match
MMCA4,B3,Stock,MAGNETI MARELLI COFAP AUTOPECAS S.A.,,,,,,,no_cotahist_match
MMCF3,B3,Stock,MAGNETI MARELLI COFAP-CIA FABR PECAS S/A,,,,,,,no_cotahist_match
MMCF4,B3,Stock,MAGNETI MARELLI COFAP-CIA FABR PECAS S/A,,,,,,,no_cotahist_match
MNBI3,B3,Stock,MLOG S.A.,,,,,,,no_cotahist_match
MTAL3,B3,Stock,CIMETAL SIDERURGIA S/A,,,,,,,no_cotahist_match
MTAL6,B3,Stock,CIMETAL SIDERURGIA S/A,,,,,,,no_cotahist_match
MTNR5,B3,Stock,METANOR - METANOL DO NORDESTE S.A.,,,,,,,no_cotahist_match
MTNR7,B3,Stock,METANOR - METANOL DO NORDESTE S.A.,,,,,,,no_cotahist_match
MWIS6,B3,Stock,MWI - SISTEMA DE COMUNICACAO S.A.,,,,,,,no_cotahist_match
NAII3,B3,Stock,NAI HOLDINGS S.A.,,,,,,,no_cotahist_match
NAII4,B3,Stock,NAI HOLDINGS S.A.,,,,,,,no_cotahist_match
NESB3,B3,Stock,NESBER S.A.,,,,,,,no_cotahist_match
NIPL3,B3,Stock,NIPLAN ENGENHARIA S.A.,,,,,,,no_cotahist_match
NKEP3,B3,Stock,NK 031 EMPREENDIMENTOS E PARTICIPAÇÕES S.A.,,,,,,,no_cotahist_match
NKEP4,B3,Stock,NK 031 EMPREENDIMENTOS E PARTICIPAÇÕES S.A.,,,,,,,no_cotahist_match
NLFA11,B3,ETF,Nu Letras Financeiras Anbima Classe De Índice - Responsabilidade Limitada,,,,,,,no_cotahist_match
NODA3,B3,Stock,NOVADATA SISTEMAS E COMPUTADORES S/A,,,,,,,no_cotahist_match
NODA6,B3,Stock,NOVADATA SISTEMAS E COMPUTADORES S/A,,,,,,,no_cotahist_match
NOGV11,B3,ETF,INTER EQI TEVA ETF BOLSA SEM ESTATAIS FDO DE ÍNDIC,,,,,,,no_cotahist_match
NOVI3,B3,Stock,NORTIS INCORPORADORA E CONSTRUTORA S.A.,,,,,,,no_cotahist_match
NXVL3,B3,Stock,NOXVILLE INVESTIMENTOS S.A.,,,,,,,no_cotahist_match
NXVL4,B3,Stock,NOXVILLE INVESTIMENTOS S.A.,,,,,,,no_cotahist_match
OBAH3,B3,Stock,GRUPO FARTURA DE HORTIFRUT S/A,,,,,,,no_cotahist_match
OBIO3,B3,Stock,OLEOPLAN S.A - ÓLEOS VEGETAIS PLANALTO,,,,,,,no_cotahist_match
ODTR3,B3,Stock,OTP S.A.,,,,,,,no_cotahist_match
OPDL3B,B3,Stock,DALETH PARTICIPACOES S.A.,,,,,,,no_cotahist_match
ORNA4B,B3,Stock,ORNATO S.A. INDL DE PISOS E AZULEJOS,,,,,,,no_cotahist_match
OULG11B,B3,ETF,Pedra Dourada Fundo De Investimento Imobiliário - FII,,,,,,,no_cotahist_match
P5RD3,B3,Stock,MATRIZ COMPANHIA METALURGICA PRADA,,,,,,,no_cotahist_match
PASS5,B3,Stock,COMPASS GAS E ENERGIA S.A.,,,,,,,no_cotahist_match
PCBU3,B3,Stock,PACAEMBU CONSTRUTORA S.A.,,,,,,,no_cotahist_match
PCEM13,B3,Stock,PORTO PECEM GERACAO ENERGIA S/A,,,,,,,no_cotahist_match
PCEM14,B3,Stock,PORTO PECEM GERACAO ENERGIA S/A,,,,,,,no_cotahist_match
PCEM15,B3,Stock,PORTO PECEM GERACAO ENERGIA S/A,,,,,,,no_cotahist_match
PCEM16,B3,Stock,PORTO PECEM GERACAO ENERGIA S/A,,,,,,,no_cotahist_match
PCEM17,B3,Stock,PORTO PECEM GERACAO ENERGIA S/A,,,,,,,no_cotahist_match
PCFV4,B3,Stock,POCOS DE FERVEDOURO S.A.,,,,,,,no_cotahist_match
PLFS3,B3,Stock,POLO FILMS INDUSTRIA E COMERCIO SA,,,,,,,no_cotahist_match
PLSP3,B3,Stock,PLASCORP PARTICIPAÇÕES S.A.,,,,,,,no_cotahist_match
PMSP13B,B3,Stock,PREFEITURA MUNICIPAL DE SAO PAULO,,,,,,,no_cotahist_match
PMSP14B,B3,Stock,PREFEITURA MUNICIPAL DE SAO PAULO,,,,,,,no_cotahist_match
PRMN3B,B3,Stock,PRODUTORES ENERGET.DE MANSO S.A.- PROMAN,,,,,,,no_cotahist_match
PRVA3,B3,Stock,PRIVALIA BRASIL S.A.,,,,,,,no_cotahist_match
PTBP4,B3,Stock,PORTOBELLO PARTICIPACOES CERAMICAS S.A.,,,,,,,no_cotahist_match
PTSL3,B3,Stock,PORTOSUL PARTICIPAÇÕES S.A.,,,,,,,no_cotahist_match
PTSL4,B3,Stock,PORTOSUL PARTICIPAÇÕES S.A.,,,,,,,no_cotahist_match
QFOF11,B3,ETF,QR BLOOMBERG FUTURE OF FINANCE FUNDO DE ÍNDICE–IE,,,,,,,no_cotahist_match
QWEB11,B3,ETF,QR CF WEB 3.0 INFRA BLOCKCHAIN FDO DE ÍNDICE IE,,,,,,,no_cotahist_match
RBNS3,B3,Stock,RODOBENS S.A,,,,,,,no_cotahist_match
RBNS4,B3,Stock,RODOBENS S.A,,,,,,,no_cotahist_match
REFC4,B3,Stock,REFINADORA CATARINENSE S.A.,,,,,,,no_cotahist_match
RFAG3,B3,Stock,REDE FEDERAL ARMAZENS GERAIS FERROV. S/A,,,,,,,no_cotahist_match
RHED4,B3,Stock,RHEDE TECNOLOGIA S.A.,,,,,,,no_cotahist_match
RIBC8,B3,Stock,RIBEIRO CORDEIRO IND E COMERCIOS.A.,,,,,,,no_cotahist_match
RIVA3,B3,Stock,RIVA 9 EMPREENDIMENTOS IMOBILIÁRIOS S.A.,,,,,,,no_cotahist_match
RJSA3,B3,Stock,RJS S.A.,,,,,,,no_cotahist_match
RNPT4,B3,Stock,RENNER PARTICIPACOES S.A.,,,,,,,no_cotahist_match
ROOS12,B3,Stock,ROOSTER S.A. INDUSTRIA DE EQUIPAMENTOS,,,,,,,no_cotahist_match
RSAN3,B3,Stock,CIA RIOGRANDENSE DE SANEAMENTO,,,,,,,no_cotahist_match
RSAN4,B3,Stock,CIA RIOGRANDENSE DE SANEAMENTO,,,,,,,no_cotahist_match
SANY6,B3,Stock,SANYO DA AMAZONIA S.A.,,,,,,,no_cotahist_match
SDRM3,B3,Stock,CIA SIDERURGICA DA AMAZONIA - SIDERAMA,,,,,,,no_cotahist_match
SDRM6,B3,Stock,CIA SIDERURGICA DA AMAZONIA - SIDERAMA,,,,,,,no_cotahist_match
SEMI11,B3,ETF,TREND ETF PHLX SEMICONDUCTOR FDO DE INV DE ÍNDICE,,,,,,,no_cotahist_match
SILO3,B3,Stock,CIA DE ARMAZENS E SILOS DO EST MG-CASEMG,,,,,,,no_cotahist_match
SILO4,B3,Stock,CIA DE ARMAZENS E SILOS DO EST MG-CASEMG,,,,,,,no_cotahist_match
SPCI6,B3,Stock,SOCIEDADE DE PARTICIP. CIMENTEIRAS S.A.,,,,,,,no_cotahist_match
SPCR3,B3,Stock,SPE CRISTINA S.A.,,,,,,,no_cotahist_match
STAL6,B3,Stock,SETAL TELECOM S.A.,,,,,,,no_cotahist_match
STOK3,B3,Stock,ESTOK COMERCIO E REPRESENTACOES S.A.,,,,,,,no_cotahist_match
SULG3,B3,Stock,COMPANHIA DE GÁS DO ESTADO DO RIO GRANDE DO SUL,,,,,,,no_cotahist_match
SVPH7,B3,Stock,SALVADOR PRAIA HOTEL S.A.,,,,,,,no_cotahist_match
TCQC3,B3,Stock,INDUSTRIA CARBOQUIMICA CATARINENSE S/A,,,,,,,no_cotahist_match
TCQC4,B3,Stock,INDUSTRIA CARBOQUIMICA CATARINENSE S/A,,,,,,,no_cotahist_match
TRBR3,B3,Stock,TRANSBRASIL S.A. LINHAS AEREAS,,,,,,,no_cotahist_match
TRBR4,B3,Stock,TRANSBRASIL S.A. LINHAS AEREAS,,,,,,,no_cotahist_match
TREG3,B3,Stock,TANGARA ENERGIA S.A.,,,,,,,no_cotahist_match
TVIT3,B3,Stock,"TIVIT TERC. DE PROC., SERV. E TEC. S.A.",,,,,,,no_cotahist_match
TXBZ5,B3,Stock,TBM - TEXTIL BEZERRA DE MENEZES S.A.,,,,,,,no_cotahist_match
USAG11,B3,ETF,TREND ETF CRSP U.S. LARGE CAP GROWTH FDO INV IND,,,,,,,no_cotahist_match
USAT4,B3,Stock,USATI PARTICIPACOES PORTUARIAS S.A.,,,,,,,no_cotahist_match
USAV11,B3,ETF,TREND ETF CRSP US LARGE CAP VALUE FDO INV IND,,,,,,,no_cotahist_match
VDMG3,B3,Stock,VEÍCULO DE DESESTATIZAÇÃO MG INVESTIMENTOS S.A.,,,,,,,no_cotahist_match
VECF3,B3,Stock,VALEC - ENG.CONSTRUCOES E FERROVIAS S.A.,,,,,,,no_cotahist_match
VLPN3,B3,Stock,ELETRICIDADE VALE PARANAPANEMA S.A.,,,,,,,no_cotahist_match
VRGL3,B3,Stock,GOL LINHAS AEREAS S.A,,,,,,,no_cotahist_match
WESG11,B3,ETF,WISE DOW JONES U.S. SELECT ESG REIT FDO INV IE,,,,,,,no_cotahist_match
WIRE3,B3,Stock,WIREX CABLE S.A.,,,,,,,no_cotahist_match
WISE11,B3,ETF,WISE S&P GLOBAL REIT FUNDO DE ÍNDICE - IE,,,,,,,no_cotahist_match
WNBR3,B3,Stock,W2W E-COMMERCE DE VINHOS S.A.,,,,,,,no_cotahist_match
WRET11,B3,ETF,TREND ETF FTSE GLOBAL REITS FDO INV DE ÍNDICE,,,,,,,no_cotahist_match
XBIO11,B3,ETF,TREND ETF BIOTECHNOLOGY NASDAQ FDO INV ÍNDICE,,,,,,,no_cotahist_match
XGEN11,B3,ETF,TREND ETF NASDAQ NEXT GENERATION 100 FDO INV IND,,,,,,,no_cotahist_match
XPML13,B3,Stock,XP MALLS FDO INV IMOB FII RESP LIM,,,,,,,no_cotahist_match
XTEC11,B3,ETF,TREND ETF FTSE CHINA TECHNOLOGY FUNDO DE INVESTIME,,,,,,,no_cotahist_match
YOUC3,B3,Stock,YOU INC INCORPORADORA E PARTICIPAÇÕES S.A.,,,,,,,no_cotahist_match
